{
  "$schema": "https://json-schema.org/draft/2020-12/schema",
  "$id": "https://github.com/Subway-Builder-Modded/schemas/special_demand_points.schema.json",
  "title": "Special Demand Content",
  "x-immutable": true,
  "x-owner": "Subway-Builder-Modded",
  "description": "Per-map content file listing every special demand point with its type, name, and relationships. Point IDs map to demand_data.json entries. This schema is immutable and owned by the Subway-Builder-Modded org. Validated against the type definitions in the accompanying types file.",
  "type": "object",
  "required": ["$schema", "version", "map_code", "points"],
  "additionalProperties": false,
  "properties": {
    "$schema": {
      "type": "string",
      "description": "JSON Schema reference for validation."
    },
    "version": {
      "type": "integer",
      "const": 1,
      "description": "Schema version. Must match the types file version."
    },
    "map_code": {
      "type": "string",
      "description": "The map/bundle identifier this content belongs to (e.g. 'FUK', 'UKY')."
    },
    "generated_at": {
      "type": "string",
      "format": "date-time",
      "description": "ISO 8601 timestamp of when this file was generated."
    },
    "points": {
      "type": "array",
      "description": "All special demand points in this map.",
      "items": { "$ref": "#/$defs/SpecialDemandPoint" }
    }
  },

  "$defs": {
    "LocalizedString": {
      "type": "object",
      "description": "A dictionary of locale-keyed display strings. '__default__' is the unlocalized fallback; additional keys are BCP 47 locale tags.",
      "required": ["__default__"],
      "properties": {
        "__default__": { "type": "string" }
      },
      "additionalProperties": { "type": "string" }
    },

    "SpecialDemandPoint": {
      "type": "object",
      "description": "A single special demand point with its type classification, display name, and optional relationships.",
      "required": ["point_id", "type", "name"],
      "additionalProperties": false,
      "properties": {
        "point_id": {
          "type": "string",
          "description": "Demand point ID as it appears in demand_data.json. Used to join content metadata with the spatial/demand data."
        },
        "type": {
          "type": "string",
          "pattern": "^[a-z][a-z0-9_]*$",
          "description": "References a DemandType.id from the types file."
        },
        "sub_type": {
          "type": ["string", "null"],
          "pattern": "^[a-z][a-z0-9_]*$",
          "description": "Optional. References a DemandSubType.id within the parent type. Provides finer classification and may override the parent icon."
        },
        "name": {
          "$ref": "#/$defs/LocalizedString",
          "description": "Display name for this point in the UI."
        },
        "pop_ids": {
          "type": "array",
          "items": { "type": "string" },
          "description": "Population group IDs assigned to this demand point in demand_data.json. Each pop represents a group of commuters travelling to this point. Required for linking content metadata to the demand simulation."
        },
        "sibling_point_ids": {
          "type": "array",
          "items": { "type": "string" },
          "description": "Optional. Other point_ids representing the same real-world entity (e.g. multiple terminals of one airport, or campus buildings of one university). The mod can group these for display."
        },
        "metadata": {
          "type": "object",
          "description": "Freeform key-value pairs. Common keys: 'source_url', 'website', 'source_dataset', 'capacity', 'beds', etc.",
          "additionalProperties": true
        }
      }
    }
  }
}
