{
  "$schema": "special_demand_points.schema.json",
  "version": 1,
  "map_code": "IZO",
  "generated_at": "2026-04-10T01:46:21.160611+00:00",
  "points": [
    {
      "point_id": "SCH_SEC_米子東高等学校_1",
      "type": "school",
      "name": {
        "__default__": "米子東高等学校",
        "ja": "米子東高等学校"
      },
      "sub_type": "high_school",
      "pop_ids": ["13222", "13340", "13568", "14632"],
      "metadata": {
        "source_dataset": "P29-13"
      }
    },
    {
      "point_id": "SCH_PRI_啓成小学校_1",
      "type": "school",
      "name": {
        "__default__": "啓成小学校",
        "ja": "啓成小学校"
      },
      "sub_type": "elementary",
      "pop_ids": [
        "13083",
        "13086",
        "13088",
        "13097",
        "13098",
        "13313",
        "13367",
        "13368"
      ],
      "metadata": {
        "source_dataset": "P29-13"
      }
    },
    {
      "point_id": "SCH_SEC_米子工業高等学校_1",
      "type": "school",
      "name": {
        "__default__": "米子工業高等学校",
        "ja": "米子工業高等学校"
      },
      "sub_type": "high_school",
      "pop_ids": ["13103", "14269", "14651", "15636"],
      "metadata": {
        "source_dataset": "P29-13"
      }
    },
    {
      "point_id": "SCH_SEC_米子南高等学校_1",
      "type": "school",
      "name": {
        "__default__": "米子南高等学校",
        "ja": "米子南高等学校"
      },
      "sub_type": "high_school",
      "pop_ids": ["13198", "13214", "13353", "13490", "14278"],
      "metadata": {
        "source_dataset": "P29-13"
      }
    },
    {
      "point_id": "SCH_PRI_明道小学校_1",
      "type": "school",
      "name": {
        "__default__": "明道小学校",
        "ja": "明道小学校"
      },
      "sub_type": "elementary",
      "pop_ids": ["13106", "13109", "13112", "13113", "13114"],
      "metadata": {
        "source_dataset": "P29-13"
      }
    },
    {
      "point_id": "SCH_SEC_湊山中学校_1",
      "type": "school",
      "name": {
        "__default__": "湊山中学校",
        "ja": "湊山中学校"
      },
      "sub_type": "junior_high",
      "pop_ids": ["13089", "13104", "13105", "13125", "13129", "13131"],
      "metadata": {
        "source_dataset": "P29-13"
      }
    },
    {
      "point_id": "SCH_PRI_就将小学校_1",
      "type": "school",
      "name": {
        "__default__": "就将小学校",
        "ja": "就将小学校"
      },
      "sub_type": "elementary",
      "pop_ids": [
        "13111",
        "13115",
        "13116",
        "13118",
        "13119",
        "13123",
        "13126",
        "13127",
        "13130",
        "13132"
      ],
      "metadata": {
        "source_dataset": "P29-13"
      }
    },
    {
      "point_id": "SCH_SEC_米子西高等学校_1",
      "type": "school",
      "name": {
        "__default__": "米子西高等学校",
        "ja": "米子西高等学校"
      },
      "sub_type": "high_school",
      "pop_ids": ["13090", "13164", "15530"],
      "metadata": {
        "source_dataset": "P29-13"
      }
    },
    {
      "point_id": "HOS_錦海リハビリテーション病院_1",
      "type": "hospital",
      "name": {
        "__default__": "錦海リハビリテーション病院",
        "ja": "錦海リハビリテーション病院"
      },
      "pop_ids": ["13412", "13502"],
      "metadata": {
        "source_dataset": "P04-20",
        "beds": 48,
        "address": "米子市錦海町３－４－５"
      }
    },
    {
      "point_id": "HOS_高島病院_1",
      "type": "hospital",
      "name": {
        "__default__": "高島病院",
        "ja": "高島病院"
      },
      "pop_ids": ["13134", "13339", "15592", "15611"],
      "metadata": {
        "source_dataset": "P04-20",
        "beds": 119,
        "address": "米子市西町６"
      }
    },
    {
      "point_id": "HOS_鳥取大学医学部附属病院_1",
      "type": "hospital",
      "name": {
        "__default__": "鳥取大学医学部附属病院",
        "ja": "鳥取大学医学部附属病院"
      },
      "pop_ids": [
        "13087",
        "13095",
        "13117",
        "13142",
        "13146",
        "13149",
        "13230",
        "13231",
        "13232",
        "13270",
        "13312",
        "13356",
        "13363",
        "13385",
        "13394",
        "13522",
        "13537",
        "14122",
        "14626",
        "15678"
      ],
      "metadata": {
        "source_dataset": "P04-20",
        "beds": 697,
        "address": "米子市西町３６番地の１"
      }
    },
    {
      "point_id": "UNI_鳥取大学_1",
      "type": "university",
      "name": {
        "__default__": "鳥取大学",
        "ja": "鳥取大学"
      },
      "sub_type": "university",
      "pop_ids": [
        "13085",
        "13120",
        "13151",
        "13176",
        "13177",
        "13189",
        "13190",
        "13215",
        "13218",
        "13264",
        "13265",
        "13288",
        "13291",
        "13310",
        "13311",
        "13329",
        "13359",
        "13365",
        "13397",
        "13493",
        "13536",
        "13540",
        "13559",
        "13679",
        "13695",
        "13714",
        "13734",
        "13737",
        "13750",
        "13760",
        "13789",
        "14031",
        "14102",
        "14250",
        "14603",
        "14760",
        "15497",
        "15567",
        "15603",
        "15645"
      ],
      "metadata": {
        "source_dataset": "P29-13"
      }
    },
    {
      "point_id": "SCH_PRI_義方小学校_1",
      "type": "school",
      "name": {
        "__default__": "義方小学校",
        "ja": "義方小学校"
      },
      "sub_type": "elementary",
      "pop_ids": [
        "13135",
        "13137",
        "13143",
        "13147",
        "13216",
        "13217",
        "13361"
      ],
      "metadata": {
        "source_dataset": "P29-13"
      }
    },
    {
      "point_id": "SCH_PRI_住吉小学校_1",
      "type": "school",
      "name": {
        "__default__": "住吉小学校",
        "ja": "住吉小学校"
      },
      "sub_type": "elementary",
      "pop_ids": [
        "13158",
        "13159",
        "13160",
        "13163",
        "13167",
        "13173",
        "13178",
        "13183",
        "13188",
        "13194"
      ],
      "metadata": {
        "source_dataset": "P29-13"
      }
    },
    {
      "point_id": "SCH_SEC_後藤ヶ丘中学校_1",
      "type": "school",
      "name": {
        "__default__": "後藤ヶ丘中学校",
        "ja": "後藤ヶ丘中学校"
      },
      "sub_type": "junior_high",
      "pop_ids": [
        "13138",
        "13139",
        "13141",
        "13156",
        "13169",
        "13179",
        "13195",
        "13221",
        "13415"
      ],
      "metadata": {
        "source_dataset": "P29-13"
      }
    },
    {
      "point_id": "HOS_養和病院_1",
      "type": "hospital",
      "name": {
        "__default__": "養和病院",
        "ja": "養和病院"
      },
      "pop_ids": [
        "13133",
        "13235",
        "13282",
        "13432",
        "13672",
        "14860",
        "15578"
      ],
      "metadata": {
        "source_dataset": "P04-20",
        "beds": 290,
        "address": "米子市上後藤３－５－１"
      }
    },
    {
      "point_id": "SCH_SEC_東山中学校_1",
      "type": "school",
      "name": {
        "__default__": "東山中学校",
        "ja": "東山中学校"
      },
      "sub_type": "junior_high",
      "pop_ids": [
        "13082",
        "13094",
        "13101",
        "13197",
        "13213",
        "13330",
        "13542",
        "13543"
      ],
      "metadata": {
        "source_dataset": "P29-13"
      }
    },
    {
      "point_id": "SCH_PRI_車尾小学校_1",
      "type": "school",
      "name": {
        "__default__": "車尾小学校",
        "ja": "車尾小学校"
      },
      "sub_type": "elementary",
      "pop_ids": [
        "13200",
        "13203",
        "13206",
        "13541",
        "13544",
        "13545",
        "13546"
      ],
      "metadata": {
        "source_dataset": "P29-13"
      }
    },
    {
      "point_id": "HOS_独_国立病院機構米子医療センター_1",
      "type": "hospital",
      "name": {
        "__default__": "（独）国立病院機構米子医療センター",
        "ja": "（独）国立病院機構米子医療センター"
      },
      "pop_ids": ["13102", "13281", "13290", "13525", "13558", "13953"],
      "metadata": {
        "source_dataset": "P04-20",
        "beds": 270,
        "address": "米子市車尾４－１７－１"
      }
    },
    {
      "point_id": "SCH_SP_米子市立米子養護学校_1",
      "type": "school",
      "name": {
        "__default__": "米子市立米子養護学校",
        "ja": "米子市立米子養護学校"
      },
      "sub_type": "special_support",
      "pop_ids": ["13208", "13712", "15195"],
      "metadata": {
        "source_dataset": "P29-13"
      }
    },
    {
      "point_id": "HOS_新田外科胃腸科病院_1",
      "type": "hospital",
      "name": {
        "__default__": "新田外科胃腸科病院",
        "ja": "新田外科胃腸科病院"
      },
      "pop_ids": ["13374", "13452"],
      "metadata": {
        "source_dataset": "P04-20",
        "beds": 31,
        "address": "米子市中島２－１－４６"
      }
    },
    {
      "point_id": "HOS_社会医療法人同愛会博愛病院_1",
      "type": "hospital",
      "name": {
        "__default__": "社会医療法人同愛会博愛病院",
        "ja": "社会医療法人同愛会博愛病院"
      },
      "pop_ids": ["13185", "13187", "13209", "13233", "13375", "14627"],
      "metadata": {
        "source_dataset": "P04-20",
        "beds": 199,
        "address": "米子市両三柳１８８０"
      }
    },
    {
      "point_id": "SCH_SEC_加茂中学校_1",
      "type": "school",
      "name": {
        "__default__": "加茂中学校",
        "ja": "加茂中学校"
      },
      "sub_type": "junior_high",
      "pop_ids": [
        "13237",
        "13238",
        "13239",
        "13240",
        "13241",
        "13242",
        "13243",
        "13272"
      ],
      "sibling_point_ids": ["SCH_SEC_加茂中学校_2"],
      "metadata": {
        "source_dataset": "P29-13"
      }
    },
    {
      "point_id": "SCH_PRI_加茂小学校_1",
      "type": "school",
      "name": {
        "__default__": "加茂小学校",
        "ja": "加茂小学校"
      },
      "sub_type": "elementary",
      "pop_ids": [
        "13247",
        "13248",
        "13249",
        "13250",
        "13251",
        "13252",
        "13253",
        "13274",
        "13275"
      ],
      "sibling_point_ids": ["SCH_PRI_加茂小学校_2"],
      "metadata": {
        "source_dataset": "P29-13"
      }
    },
    {
      "point_id": "SCH_PRI_河崎小学校_1",